Title,URL,Text
"Ditanya soal Lembaga Kehakiman yang Cenderung Diintervensi Kekuasaan, Ini Jawaban Prabowo",http://nasional.kompas.com/read/2023/12/12/21253061/ditanya-soal-lembaga-kehakiman-yang-cenderung-diintervensi-kekuasaan-ini,"Calon presiden (capres) nomor urut 2, Prabowo Subianto mengatakan bahwa lembaga kehakiman harus independen.
Hal itu disampaikan Prabowo menjawab pertanyaan dari panelis pada debat capres di kantor Komisi Pemilihan Umum (KPU) RI, Jakarta Pusat, Selasa (12/12/2023).
“Lembaga kekuasaan kehakiman saat ini cenderung diintervensi oleh cabang kekuasaan lainnya. Apakah Anda setuju dengan pernyataan tersebut? Apa alasannya dan apa komitmen Anda untuk menjaga independensi kekuasaan kehakiman?” tanya moderator membacakan pertanyaan panelis.
Prabowo pun awalnya menjawab “setuju”.
“Saya sangat setuju,” kata Prabowo.
 
Namun, Ketua Umum Partai Gerindra ini menegaskan bahwa lembaga kehakiman harus independen.
“Bahwa kehakiman harus independen, kehakiman, yudikatif, harus independen dan harus kuat dan tidak boleh diintervensi oleh kekuasaan,” ujar Prabowo.
Prabowo lantas berkomitmen memperkuat lembaga kehakiman apabila ia menerima mandat menjadi Presiden.
“Saya akan memperbaiki kualitas hidup semua hakim-hakim di RI, semua pekerja di sekitar pengadilan dan semua penegak hukum, akan saya perbaiki kualitas hidup supaya tidak dapat diintervensi atau disogok,” kata Prabowo.
 
Sebelumnya, Prabowo juga sempat menanggapi pernyataan capres nomor urut 3, Ganjar Pranowo, soal putusan Mahkamah Konstitusi (MK).
Putusan MK yang dimaksud diduga mengacu pada Putusan MK Nomor 90/PUU-XXI/2023 yang memperbolehkan seorang pejabat yang terpilih dari pemilu, termasuk kepala daerah di segala tingkatan, bisa mendaftarkan diri sebagai capres-cawapres walau belum berusia 40 tahun.
Diketahui, putusan itu membukakan pintu untuk putra sulung Presiden Joko Widodo (Jokowi), Gibran Rakabuming Raka, menjadi cawapres Prabowo dalam statusnya sebagai Wali Kota Solo di usia 36 tahun.
""Saya kira mengenai Mahkamah Konstitusi aturannya sudah jelas. Kita juga bukan anak kecil, rakyat kita juga pandai, rakyat kita lihat, rakyat kita tahu, Mas Ganjar. Kita tahu lah bagaimana prosesnya,"" kata Prabowo.
 

Menteri Pertahanan itu sempat terdiam beberapa saat setelah menyampaikan bahwa ""kita tahu bagaimana prosesnya"".
Yang intervensi siapa?"" tanya Prabowo melanjutkan jawabannya.
""Intinya adalah, kita tegakkan konstitusi. Kita tegakkan undang-undang. Kita perbaiki yang kurang sempurna dan kita patuh pada komitmen undang-undang itu sendiri,"" katanya lagi.
Diketahui, debat pertama ini mengambil tema seputar hukum, hak asasi manusia (HAM), pemerintahan, pemberantasan korupsi, dan penguatan demokrasi.
 
"
CEK FAKTA: Prabowo Sebut Harga-harga Terkendali,http://nasional.kompas.com/read/2023/12/12/20505601/anies-klaim-jadi-gubernur-jakarta-yang-paling-banyak-beri-izin-pendirian,"Calon presiden (capres) nomor urut 1 Anies Baswedan mengeklaim menjadi Gubernur DKI Jakarta yang paling banyak memberikan izin pendirian rumah ibadah. Hal itu disampaikan dalam debat pertama capres di kantor Komisi Pemilihan Umum (KPU) RI, Jakarta, Selasa (12/12/2023) malam. Mulanya, capres nomor urut 2 Prabowo Subianto menanyakan bagaimana cara Anies untuk menghadapi protes masyarakat minoritas soal pendirian rumah ibadah. “Bagaimana tanggapan Bapak tentang keluhan adanya kelompok-kelompok minoritas yang ingin membuat tempat ibadah, tapi sangat sulit karena faktor-faktor yang dipersulit birokrasi dan lain sebagainya?” tanya Prabowo.   Kemudian, Anies menyampaikan bahwa selama menjabat sebagai Gubernur DKI Jakarta, ia banyak menuntaskan persoalan izin pendirian gereja yang macet selama puluhan tahun.  “Pak Prabowo perlu kami sampaikan, ketika kami bertugas di Jakarta, maka ada begitu banyak izin-izin gereja yang mandek 30 tahun, 40 tahun, dan tuntas dibereskan,” jawab Anies. Ia menyatakan, saat itu ada banyak antrean perizinan pendirian tempat ibadah kelompok minoritas di Jakarta yang tak kunjung selesai.  “Antrean yang amat panjang yang tidak pernah selesai, yang kemudian banyak kelompok agama dari Buddha, Hindu, Kristen,” sebut dia.  “Yang mengalami kesulitan mendirikan tempat ibadah mereka menerima izin tempat ibadah dan mereka bisa beribadah dengan baik,” sambungnya.  Momen Anies Singgung Prabowo dan Cawapres Milenial saat Debat Capres Terakhir, Anies menekankan bahwa kepemimpinannya di Jakarta selalu menunjukkan keberpihakan pada semua masyarakat, tak terkecuali kelompok minoritas agama.  “Kalau boleh saya laporkan dalam sejarah gubernur Jakarta, yang paling banyak memberikan izin rumah inadah adalah Gubernur Anies Baswedan,” imbuh dia.
"
CEK FAKTA: Anies Sebut Kasus Kematian Harun Al Rasyid Tidak Ada Kejelasan,http://nasional.kompas.com/read/2023/12/12/20404131/jawab-prabowo-ganjar-pupuk-langka-terjadi-di-papua-sumatera-utara-ntt-ntb,"Calon presiden nomor urut 3, Ganjar Pranowo mengatakan bahwa pupuk langka tidak hanya terjadi di daerah yang pernah dipimpinnya, yaitu Jawa Tengah.
Menurut Ganjar, pupuk langka bahkan terjadi di hampir seluruh wilayah Indonesia. Ini disampaikan untuk menjawab pertanyaan calon presiden nomor urut 2, Prabowo Subianto yang bertanya soal kelangkaan pupuk di Jawa Tengah.
""Saya harus mengingatkan, Pak, pupuk langka terjadi di Papua, Pak, pupuk langka terjadi di Sumatera Utara, Pak, pupuk langka terjadi di NTT, NTB, Kalimatan Timur, termasuk bensin,"" kata Ganjar menjawab Prabowo dalam debat capres hari pertama, di Kantor KPU, Jakarta, Selasa (12/12/2023) malam.
 
Ganjar menegaskan, hal itu perlu disampaikan pada Prabowo karena mengetahui, Ketua Umum Partai Gerindra itu pernah menjabat sebagai Ketua Umum DPN Himpunan Kerukunan Tani Indonesia (HKTI) selama 2 periode.
""Mungkin yang bapak sedikit agak lupa untuk saya bisa mengingatkan karena Bapak pernah menjadi ketua HKTI, Pak,"" imbuh Ganjar.
Mantan Gubernur Jawa Tengah ini juga mengingatkan tentang data petani yang tidak pernah beres sampai sekarang.
Menurut dia, masalah ini karena Indonesia belum menerapkan kebijakan satu data, termasuk untuk mengelola para petani.
 
""Kalau kemudian satu data petani itu bisa kita kelola, distribusi pupuknya harus bisa sampai dan tepat sasaran,"" jelas Ganjar.
Politikus PDI-P ini turut bercerita bahwa ia pernah menghubungi Wakil Presiden Ma'ruf Amin tentang masalah pertanian.
Masih soal pupuk, Ganjar meminta pasokan itu tidak dibatasi. Ia pun berjanji tidak akan membatasi pupuk jika terpilih menjadi Presiden RI pada Pemilu 2024.
""Maka ini yang saya telpon langsung kepada Pak Wapres waktu itu, 'Pak Wapres please, kasih tambahan, kalau tidak, tidak cukup'. Maka ini terjadi di seluruh Indonesia dan ini yang harus kita kerjakan nanti,"" pungkasnya.
"
Anies: Tidak Ada Keadilan di Tanah Papua,http://nasional.kompas.com/read/2023/12/12/20233661/anies-tidak-ada-keadilan-di-tanah-papua,"Calon presiden (Capres) nomor urut 1, Anies Baswedan menilai, masalah konflik yang terjadi di Papua bukan hanya persoalan kekerasan.
Anies berpandangan, masalah yang terjadi di bumi cendrawasih itu lantaran tidak terjadinya keadilan.
""Masalahnya bukan kekerasan, di Jakarta saja beda pandangan, ada yang memandang separatisme, teroris, ini kriminal, di Jakarta beda pandangan,"" kata Anies.
""Apa masalah utamanya? Tidak ada keadilan di tanah Papua,"" ujar Eks Gubernur DKI Jakarta itu.
 
Anies menilai, penyelesaian masalah di Papua bukan hanya menghilangkan kekerasan. Namun, menghadirkan kedamaian di Papua.
""Jadi tujuannya bukan semata-mata meniadakan kekerasan, damai itu bukan tidak ada kekerasan, damai itu keadilan,"" imbuhnya.
Debat perdana Pilpres 2024 yang digelar Selasa malam ini diikuti oleh tiga kandudat capres yakni Anies Baswedan, Prabowo Subianto, dan Ganjar Pranowo.
Masing-masing akan datang berbarengan ke arena debat bersama calon wakil presiden pendamping mereka.
 
Anies ditemani Muhaimin Iskandar, Prabowo dengan Gibran Rakabuming Raka dan Ganjar bersama Mahfud Md.
Dalam debat ini, Capres duduk melingkar di tengah arena debat dan diberi kesempatan sepenuhnya untuk berbicara.
Tema debat hari ini meliputi pemerintahan, hukum, hak asasi manusia (HAM), pemberantasan korupsi, penguatan demokrasi, peningkatan layanan publik, dan kerukunan warga.
Debat diselenggarakan mulai pukul 19.00 dan disiarkan secara langsung. Debat berjalan selama 150 menit, 30 di menit di antaranya untuk jeda iklan yang ditempatkan di antara 6 segmen debat.
"
Prabowo Puji Jokowi: Beliau Presiden Paling Sering ke Papua,http://nasional.kompas.com/read/2023/12/12/20193831/prabowo-puji-jokowi-beliau-presiden-paling-sering-ke-papua,"Calon presiden nomor urut 2 Prabowo Subianto memuji kinerja Presiden Joko Widodo (Jokowi) yang sering ke Papua.
Hal itu disampaikan Prabowo dalam debat perdana capres 2024 di kantor Komisi Pemilihan Umum (KPU), Jakarta Pusat, Selasa (12/12/2023).
“Presiden Jokowi adalah presiden di RI yang paling banyak ke Papua,” kata Prabowo.
 
Prabowo menambahkan, Jokowi berkunjung Papua lebih dari 19 kali selama menjadi presiden.
“Dan peningkatan pertumbuhan ekonomi di bawah pemerintah Pak Jokowi yang paling pesat dan tinggi dalam sejarah Indonesia,” kata Prabowo.
“Jadi akan saya lanjutkan,” tutur dia.
 
Debat pertama ini mengambil tema seputar hukum, HAM, pemerintahan, pemberantasan korupsi, dan penguatan demokrasi.
"
Anies Anggap Hukum Bengkok Disesuaikan Kepentingan Penguasa,http://nasional.kompas.com/read/2023/12/12/20155531/anies-anggap-hukum-bengkok-disesuaikan-kepentingan-penguasa,"Calon presiden (Capres) nomor urut 1 Anies Baswedan menyatakan pada saat ini praktik hukum di Indonesia tidak tidak berjalan sesuai dengan prinsip negara hukum.
""Pada saat ini, kita melihat hukum harusnya tegak. Inilah hukum, tapi dalam kenyataannya dia bengkok, dan kondisi ini tidak boleh didiamkan, tidak boleh dibiarkan, dan harus berubah,"" kata Anies dalam debat capres di Komisi Pemilihan Umum (KPU), Jakarta, Selasa (12/12/2023).
Anies mengatakan, saat ini penyelenggaraan tatanan pemerintahan tidak sesuai dengan prinsip-prinsip negara hukum.
 

Padahal menurut Anies, Indonesia adalah negara hukum yang seharusnya menjunjung supremasi hukum.
""Negara ini adalah negara hukum, bukan negara kekuasaan. Dalam negara hukum, kekuasaan diatur oleh hukum. Dalam negara kekuasaan, hukum diatur oleh penguasa,"" ujar Anies.
 
""Banyak aturan ditekuk sesuai dengan kepentingan yang sedang memegang kekuasaan. Apakah ini akan diteruskan? Tidak. Ini harus diubah, ini harus diperbaiki,"" sambung Anies.
"
"Singgung soal Orangtua Ketua BEM UI yang Diduga Diintimidasi, Ganjar: Ini Harus Usai",http://nasional.kompas.com/read/2023/12/12/20111771/singgung-soal-orangtua-ketua-bem-ui-yang-diduga-diintimidasi-ganjar-ini,"Calon presiden (capres) nomor urut 3, Ganjar Pranowo menegaskan bahwa praktik-praktik intimidasi terhadap mereka yang menyuarakan pendapatnya harus dihentikan.
Hal ini disampaikan Ganjar saat memaparkan visi dan misinya dalam debat perdana capres untuk Pemilihan Presiden (Pilpres) 2024.
Awalnya, Ganjar mengatakan bahwa ada beberapa kasus masyarakat yang menyuarakan pendapatnya malah harus berurusan dengan aparat keamanan.
""Saya mendengar ketika demokratisasi mesti berjalan dan demokrasi mesti kita jaga bersama, ada Ibu Sinta yang ketika menyampaikan pendapat harus berurusan dengan aparat keamanan, ada Melki ketua BEM yang kemudian ibunya harus diperiksa,"" kata Ganjar, Selasa malam.
 
Ganjar lantas menegaskan bahwa praktik-praktik seperti itu tidak boleh terjadi lagi dan hal tersebut bakal terwujud bila pemerintahan dijalankan dengan baik.
""Maka yang seperti ini harus usai dan mereka bisa mendapatkan kebaikan-kebaikan kalau governance terjadi,"" ujar politikus PDI Perjuangan itu.
Ganjar juga menyinggung pentingnya melibatkan semua pihak dalam pembangunan yang dilakukan pemerintah.

 
Ia lantas mengungkapkan, dapat pertanyaan dari masyarakat Dayak di Kalimantan yang ingin mendapatkan akses yang sama untuk dilibatkan dalam program pembangunan.
""Semua ini bisa berjalan kalau kemudian pemerintahannya bersih, pemerintahannya bisa akomodatif dan kita sikat korupsi itu tidak dengan kata-kata, dengan keseriusan,"" kata Ganjar.
Diketahui, tema debat capres perdana meliputi isu pemerintahan, hukum, hak asasi manusia (HAM), pemberantasan korupsi, penguatan demokrasi, peningkatan layanan publik, dan kerukunan warga.
Debat akan diselenggarakan mulai pukul 19.00 dan disiarkan secara langsung.
Dijadwalkan bahwa debat berjalan selama 150 menit, 30 di menit di antaranya untuk jeda iklan yang ditempatkan di antara enam segmen.
 
"
Ketika Anies Berkeliling Salami Tim Pemenangan Lawan Sebelum Debat Capres Dimulai...,http://nasional.kompas.com/read/2023/12/12/19402131/ketika-anies-berkeliling-salami-tim-pemenangan-lawan-sebelum-debat-capres,"Calon presiden (capres) nomor urut 1, Anies Baswedan terlihat menyalami sejumlah petinggi tim kampanye masing-masing pasangan calon presiden dan calon wakil presiden (capres-cawapres) di lokasi debat, yakni di kantor Komisi Pemilihan Umum (KPU) RI, Menteng, Jakarta Pusat, Selasa (12/12/2023) malam.
Pantauan Kompas.com di lokasi, Anies yang mengenakan setelan jas dan peci hitam terlihat bersalaman dengan pasangan nomor urut 2 Prabowo Subianto-Gibran Rakabuming Raka, serta pasangan nomor urut 3 Ganjar Pranowo-Mahfud MD.
Setelahnya, Anies berkeliling ke barisan tim pemenangan masing-masing pasangan calon (paslon), bukannya kembali ke tempat duduk yang telah disediakan.
Anies juga terlihat menyalami petinggi tim kampanyenya sendiri, mulai dari Jazilul Fawaid, Habib Aboe Bakar Alhabsyi, hingga Ahmad Syaikhu.
 
Kemudian, Anies menyalami petinggi tim kampanye Prabowo-Gibran, mulai dari Airlangga Hartarto, Yusril Ihza Mahendra, Zulkifli Hasan, Anis Matta, hingga Ahmad Muzani.
Tidak berhenti sampai situ, Anies juga menyalami petinggi tim kampanye Ganjar-Mahfud, seperti Mardiono, Hary Tanoesoedibjo, hingga Osman Sapta Oedang (OSO).
Sementara itu, Prabowo-Gibran, Ganjar-Mahfud, dan Muhaimin Iskandae terlihat berada di posisinya masing-masing memperhatikan aktivitas Anies tersebut.

Diketahui, kehadiran tiga paslon di gedung KPU RI untuk melakukan debat pemilihan presiden (Pilpres) 2024.
Agenda debat pertama pada Selasa, 12 Desember 2023, adalah debat capres.
Dalam debat capres pertama ini akan mengangkat isu tentang pemerintahan, hukum, hak asasi manusia (HAM), pemberantasan korupsi, penguatan demokrasi, peningkatan layanan publik, dan kerukunan warga.
 
"
Ganjar Didampingi Mahfud Tiba di KPU untuk Hadapi Debat Capres 2024,http://nasional.kompas.com/read/2023/12/12/18370991/ganjar-didampingi-mahfud-tiba-di-kpu-untuk-hadapi-debat-capres-2024,"Pasangan calon presiden dan calon wakil presiden (capres-cawapres) nomor urut 3, Ganjar Pranowo-Mahfud MD tiba di Kantor Komisi Pemilihan Umum (KPU) RI, Jakarta pada Selasa (12/12/2023) pukul 18.14 WIB.
Kehadiran keduanya untuk mengikuti debat Pilpres 2024. Adapun yang akan menjalani debat pertama ini yaitu para capres.
Pantauan Kompas.com di lokasi, Ganjar-Mahfud tampak kompak mengenakan baju berwarna putih masing-masing bertuliskan ""Sat-set"" dan ""Tas-tes"".
Setibanya di gedung KPU RI, keduanya terlihat langsung dikerumuni awak media untuk mengambil dokumentasi.
 
Namun, Ganjar tampak hanya tersenyum sembari berjalan memasuki gedung KPU RI saat ditanya kesiapannya jelang debat perdana.
Selain Ganjar-Mahfud, terlihat pula anggota elit partai politik pengusung keduanya, yaitu PDI-P, Partai Persatuan Pembangunan (PPP), Perindo dan Partai Hanura turut mendampingi.
Di antaranya, Sekretaris Jenderal PDI-P Hasto Kristiyanto dan Ketua Bidang Kehormatan PDI-P Komarudin Watubun. Kemudian, ada juga politikus PDI-P Aria Bima.
Hadir juga Ketua Umum Partai Hanura Oesman Sapta Odang beserta jajaran pengurus partai datang di KPU.
 

Sebelum tiba di KPU, pasangan capres nomor urut 3 berkumpul terlebih dulu di Gedung High End, Jakarta Pusat yang merupakan markas tempat berkumpulnya Tim Pemenangan Nasional (TPN) Ganjar-Mahfud.
Di sana, Ganjar mengaku siap menghadapi debat perdana yang akan mengangkat isu tentang pemerintahan, hukum, hak asasi manusia (HAM), pemberantasan korupsi, penguatan demokrasi, peningkatan layanan publik, dan kerukunan warga.
""Insya Allah sudah siap. Kemarin sudah komunikasi, ngobrol dengan tim, dapat masukan dari kawan-kawan, substansi, teknis gitu ya. Seneng lah. Insya Allah.. Bismillah,"" ujar Ganjar gedung di High End.
 
"
Keluarga Besar Mahfud MD Doa Bersama Hadapi Debat Capres-Cawapres,http://nasional.kompas.com/read/2023/12/12/18115211/elektabilitas-anies-muhaimin-di-peringkat-ke-2-litbang-kompas-cak-imin,"JAKARTA, KOMPAS.com - Calon wakil presiden (cawapres) nomor urut 1, Muhaimin Iskandar bersyukur dengan hasil survei Litbang Kompas yang menunjukkan elektabiltias pasangan calon nomor urut 1 berada di peringkat kedua.
Menurut pria yang karib disapa Cak Imin ini, hasil survei tersebut menunjukkan ada perkembangan elektabilitas dari pasangan Anies Baswedan-Muhaimin Iskandar.
""Ya bersyukur ada progres,"" kata Cak Imin di Kompleks Widya Chandra, Jakarta, Selasa (12/12/2023), dikutip dari YouTube Kompas TV.
Cak Imin pun berharap, debat calon presiden (capres) yang akan digelar pada Selasa malam ini dapat membuat masyarakat Indonesia memahami visi-misi para kandidat.
 
""Kita berharap debat ini menjadikan semua bangsa kita mengerti betul apa yang menjadi target, keinginan, visi-misi,"" ujarnya.

Hasil jajak pendapat Litbang Kompas pada 29 November-4 Desember 2023 menunjukkan bahwa pasangan nomor urut 2, Prabowo Subianto-Gibran Rakabuming, memiliki elektabilitas sebesar 39,3 persen.
Prabowo-Gibran unggul cukup jauh dibandingkan Anies Baswedan-Muhaimin Iskandar dengan 16,7 persen dan Ganjar Pranowo-Mahfud MD sebesar 15,3 persen.
 

Sementara itu, masih ada 28,7 persen responden yang belum menentukan pilihan atau merahasiakan pilihan mereka.
Survei Litbang Kompas ini melibatkan 1.364 responden yang dipilih secara acak menggunakan metode pencuplikan sistematis bertingkat di 38 provinsi di Indonesia.
Metode tersebut disebut memiliki tingkat kepercayaan 95 persen dan margin of error kurang lebih 2,65 persen dalam kondisi penarikan sampel acak sederhana. Survei dibiayai sepenuhnya oleh Harian Kompas.
 
"
"Berbaju Hitam ke KPU, Komarudin Watubun PDI-P: Empati Kepada Keluarga Korban Pelanggaran HAM 1998",http://nasional.kompas.com/read/2023/12/12/18033411/jelang-debat-capres-ganjar-insya-allah-sudah-siap,"Calon presiden (capres) nomor urut 3, Ganjar Pranowo mengaku sudah siap menghadapi debat capres yang akan dilaksanakan di Kantor Komisi Pemilihan Umum (KPU) RI, Jl Imam Bonjol, Menteng, Jakarta Pusat, Selasa (12/12/2023) malam ini.
Ganjar juga menegaskan tidak merasa khawatir menghadapi debat yang akan dimulai beberapa jam lagi.
""Engga lah (tidak deg-degan). Biasa saja, kan kita pernah debat. Insya Allah sudah siap,"" ujar Ganjar di Gedung High End, Kebon Sirih, Jakarta Pusat, Selasa sore.
Menurut Ganjar, dirinya sudah menerima masukan dari para relawan di akar rumput.
 
Ganjar juga mengaku sudah mendapat masukan dari calon wakil presiden (cawapres) yang mendampinginya, Mahfud MD.
""Ada masukan dari bawah, soal substansi dan lain-lain,"" katanya.
Mantan Gubernur Jawa Tengah ini pun sempat ditanya terkait hasil survei sejumlah pihak tentang elektabilitas dirinya dan cawapres Mahfud MD.
Terkait hal itu, Ganjar menyatakan sudah mengonfirmasikan kepada masing-masing lembaga yang menerbitkan hasil survei.
Selain itu, setelah debat capres malam ini, Ganjar mengatakan bahwa dirinya dan Mahfud akan kembali turun ke masyarakat untuk berkampanye.
""Tugas kita bergerak, dan Insya Allah kita akan berkunjung kembali (ke masyarakat) untuk makin solid dan makin semangat,"" ujarnya.
 

Adapun Ganjar dan Mahfud MD akan berangkat ke Gedung KPU RI dari Gedung High End secara bersama-sama untuk mengikuti debat capres perdana malam ini.
Sebagai informasi, debat capres perdana ini akan mengangkat isu pemerintahan, hukum, hak asasi manusia (HAM), pemberantasan korupsi, penguatan demokrasi, peningkatan layanan publik, dan kerukunan warga.
Debat akan diikuti oleh tiga capres, yakni Anies Baswedan, Prabowo Subianto dan Ganjar Pranowo.
Rencananya, debat perdana akan dimulai pukul 19.00 WIB hingga 21.00 WIB.
 
"
"Sebelum Debat, Anies-Muhaimin Akan Sapa Simpatisan yang Nonton Bareng di Sekretariat Timnas",http://nasional.kompas.com/read/2023/12/12/13472741/sebelum-debat-anies-muhaimin-akan-sapa-simpatisan-yang-nonton-bareng-di,"Sebelum mengikuti debat calon presiden dan calon wakil presiden (capres-cawapres), pasangan capres-cawapres nomor urut 1, Anies Baswedan dan Muhaimin Iskandar berencana menyapa simpatisan yang menggelar nonton bareng.
Hal itu disampaikan Juru Bicara Tim Nasional Pemenangan (Timnas) Anies-Muhaimin, Angga Putra Fidrian melalui pesan singkat, Selasa (12/12/2023).
""Akan bertemu dan menyapa masyarakat yang nonton bareng,"" ujar Angga.
 
Angga menyebutkan, nonton bareng simpatisan itu akan digelar di Sekretariat Timnas Amin di Jalan Diponegoro 10, Menteng, Jakarta Pusat.
Anies dan Cak Imin akan tiba di lokasi sekitar pukul 18.00 WIB bersama keluarga masing-masing.

Angga juga sebelumnya menyebut Kapten Timnas Amin, Muhammad Syaugi meminta agar seluruh calon legislatif dari partai Koalisi Perubahan: Nasdem; Partai Keadilan Sejahtera (PKS); dan Partai Kebangkitan Bangsa (PKB) menggelar nonton bareng.
""Kapten Timnas bilang bahwa caleg di dapilnya harus bikin nobar,"" ucapnya.
 
Diketahui, debat perdana Pemilu Presiden 2024 yang digelar Selasa, 12 Desember 2023, adalah debat khusus capres.
Tema debat perdana adalah hukum, hak asasi manusia, pemerintahan, pemberantasan Korupsi, dan penguatan demokrasi.
Debat perdana capres tersebut akan digelar di gedung KPU RI pada pukul 19.00 WIB.
"
Prabowo Sudah Latihan Debat Capres dengan Yusril hingga Budiman Sudjatmiko,http://nasional.kompas.com/read/2023/12/12/12424711/prabowo-sudah-latihan-debat-capres-dengan-yusril-hingga-budiman-sudjatmiko,"Komandan Tim Bravo (Komunikasi) Tim Kampanye Nasional (TKN) Prabowo Subianto-Gibran Rakabuming Raka, Budisatrio Djiwandono, mengungkapkan, capres nomor urut 2 Prabowo sudah berlatih untuk menghadapi debat capres yang akan digelar pada Selasa (12/12/2023) malam.  Budi menyebutkan, diskusi itu dilakukan pada Senin (11/12/2023) sore.  ""Kami bertemu kemarin setelah Pak Prabowo menghadiri rapat paripurna akhir tahun di Istana Negara pada sore hari. Dalam pertemuan itu, kami brainstorming dan diskusi terkait tema debat nanti,” ujar Budi dalam keterangannya, Selasa.    Budi menjelaskan, ada sejumlah petinggi TKN Prabowo-Gibran yang ikut berdiskusi dengan Prabowo mengenai debat capres.
Mereka yakni Rosan Roeslani, Sufmi Dasco Ahmad, Yusril Ihza Mahendra, Ridwan Kamil, Budiman Sudjatmiko, Helmy Yahya, Burhanudin Abdullah, Dadan Hindrayana, Habiburokhman, Hasan Nasbi, dan Munafrizal Manan. Prabowo sendiri tetap fokus bertugas sebagai Menteri Pertahanan (Menhan) pada hari ini. ""Pak Prabowo tetap mengutamakan tugas sebagai Menteri Pertahanan. Pagi ini, Pak Prabowo akan menyerahkan pesawat NC212i buatan anak bangsa dari PT Dirgantara Indonesia kepada TNI AU di Halim Perdanakusuma di pagi hari,” tuturnya.    Sebagai informasi, debat capres-cawapres digelar Komisi Pemilihan Umum (KPU) pada Selasa (12/12/2023) hari ini.  Debat capres perdana ini akan mengangkat isu pemerintahan, hukum, hak asasi manusia (HAM), pemberantasan korupsi, penguatan demokrasi, peningkatan layanan publik, dan kerukunan warga.
"
